{
	"seed": 100,
	"network": "Chicago, Illinois",
	"problem": "DARP",
	"max_speed_factor": 0.5,
	"replicas": 1,
	"requests": 100,
	"instance_filename": ["network", "problem", "requests"],
	"places":[
		{
			"name": "depot1",
			"type": "location",
			"lon": -87.738680,
			"lat": 41.954958
		},
		{
			"name": "depot2",
			"type": "location",
			"lon": -87.679628,
			"lat": 41.899278
		},
		{
			"name": "depot3",
			"type": "location",
			"lon": -87.678255,
			"lat":  41.839457
		},
		{
			"name": "depot4",
			"type": "location",
			"lon": -87.619032,
			"lat": 41.763641
		},
		{
			"name": "depot5",
			"type": "location",
			"lon": -87.566847,
			"lat": 41.711383
		}	
	],
	"parameters":[
		{
			"name": "min_early_departure",
			"type": "integer",
			"value": 0,
			"time_unit": "h"
		},
		{
			"name": "max_early_departure",
			"type": "integer",
			"value": 23,
			"time_unit": "h"
		},
		{
			"name": "min_distance",
			"type": "integer",
			"value": 500,
			"length_unit": "m"
		},
		{
			"name": "depots",
			"type": "array_locations",
			"locs": "random",
			"size": 5,
			"value": ["depot1", "depot2", "depot3", "depot4", "depot5"]
		},
		{
			"name": "graphml",
			"type": "graphml",
			"value": false
		}
	],
	"attributes": [
		{  
			"name": "time_stamp",
			"type": "integer",
			"time_unit": "s",
			"pdf": [ {	"type": "normal",
						"loc": 25200,
						"scale": 2700
					} ],
			"constraints": [ "time_stamp >= 0", 
							"time_stamp >= min_early_departure",
							 "time_stamp <= max_early_departure"
						   ]
		},
		{
			"name": "earliest_departure",
			"type": "integer",
			"time_unit": "s",
			"expression": "time_stamp",
			"constraints": [ "earliest_departure >= 0", 
							"earliest_departure >= min_early_departure",
							 "earliest_departure <= max_early_departure"
						   ]
		},
		{
			"name": "reaction_time",
			"type": "integer",
			"time_unit": "s",
			"pdf": [ {	"type": "normal",
						"loc": 300,
						"scale": 180
					} ],
			"constraints": [ "reaction_time >= 0"]
		},
		{
			"name": "latest_departure",
			"type": "integer",
			"time_unit": "s",
			"expression": "time_stamp + reaction_time"
		},
		{
			"name": "earliest_arrival",
			"type": "integer",
			"time_unit": "s",
			"expression": "latest_arrival - reaction_time"
		},
		{
			"name": "latest_arrival",
			"type": "integer",
			"time_unit": "s",
			"expression": "earliest_departure + direct_travel_time + (direct_travel_time * 0.5)"
		},
		{  
			"name": "origin",
			"type": "location"
		},
		{  
			"name": "destination",
			"type": "location"
		},
		{
			"name": "direct_travel_time",
			"type": "integer",
			"time_unit": "s",
			"expression": "dtt(origin,destination)",
			"constraints": ["direct_travel_time >= 0"]
		},
		{
			"name": "direct_distance",
			"type": "integer",
			"length_unit": "m",
			"expression": "dist_drive(origin,destination)",
			"constraints": ["direct_distance >= min_distance"]
		}
	],
	"travel_time_matrix": ["bus_stations", "depots"]
}