{
	"seed": 1,
	"network": "Maastricht, Netherlands",
	"problem": "DARP",
	"max_speed_factor": 0.5,
	"replicas": 1,
	"requests": 20,
	"instance_filename": ["network", "problem", "requests"],
	"parameters": [
		{
			"name": "min_early_departure",
			"type": "float",
			"value": 8.0,
			"time_unit": "h"
		},
		{
			"name": "max_early_departure",
			"type": "float",
			"value": 18.0,
			"time_unit": "h"
		},
		{
			"name": "graphml",
			"type": "graphml",
			"value": true
		}
	],
	"attributes": [
		{
			"name": "time_stamp",
			"type": "integer",
			"time_unit": "s",
			"pdf": [
				{
					"type": "uniform",
					"loc": 28800,
					"scale": 36000
				}
			],
			"constraints": [
				"time_stamp >= 0",
				"time_stamp >= min_early_departure",
				"time_stamp <= max_early_departure"
			],
			"dynamism": 0
		},
		{
			"name": "pickup_from",
			"type": "integer",
			"time_unit": "s",
			"expression": "time_stamp"
		},
		{
			"name": "pickup_to",
			"type": "integer",
			"time_unit": "s",
			"expression": "pickup_from + 900"
		},
		{
			"name": "dropoff_from",
			"type": "integer",
			"time_unit": "s",
			"expression": "pickup_to + drivingDuration"
		},
		{
			"name": "dropoff_to",
			"type": "integer",
			"time_unit": "s",
			"expression": "dropoff_from + 900"
		},
		{
			"name": "origin",
			"type": "location"
		},
		{
			"name": "destination",
			"type": "location",
			"subset_locations": "hospitals"
		},
		{
			"name": "drivingDuration",
			"type": "integer",
			"time_unit": "s",
			"expression": "dtt(origin,destination)"
		},
		{
			"name": "drivingDistance",
			"type": "integer",
			"length_unit": "m",
			"expression": "dist_drive(origin,destination)"
		},
		{
			"name": "load",
			"type": "integer",
			"pdf": [
				{
					"type": "uniform",
					"loc": 1,
					"scale": 0
				}
			]
		},
		{
			"name": "service_time",
			"type": "integer",
			"time_unit": "s",
			"pdf": [
				{
					"type": "uniform",
					"loc": 180,
					"scale": 120
				}
			]
		},
		{
			"name": "max_ride_time",
			"type": "integer",
			"time_unit": "s",
			"expression": "drivingDuration * 1.5"
		},
		{
			"name": "max_daily_ride_time",
			"type": "integer",
			"time_unit": "s",
			"pdf": [
				{
					"type": "uniform",
					"loc": 7200,
					"scale": 1800
				}
			]
		},
		{
			"name": "excess_ride_time",
			"type": "integer",
			"time_unit": "s",
			"expression": "max_ride_time - drivingDuration"
		}
	]
}
