{
  "seed": 1,
  "network": "Maastricht, Netherlands",
  "problem": "DARP",
  "set_fixed_speed": {
    "vehicle_speed_data": 20.0,
    "vehicle_speed_data_unit": "kmh"
  },
  "replicas": 1,
  "requests": 12,
  "instance_filename": [
    "network",
    "problem",
    "requests",
    "min_early_departure",
    "max_early_departure"
  ],
  "parameters": [
    {
      "name": "min_early_departure",
      "type": "float",
      "value": 7.0,
      "time_unit": "h"
    },
    {
      "name": "max_early_departure",
      "type": "float",
      "value": 8.0,
      "time_unit": "h"
    },
    {
      "name": "graphml",
      "type": "graphml",
      "value": true
    }
  ],
  "attributes": [
    {
      "name": "time_stamp",
      "type": "integer",
      "time_unit": "s",
      "pdf": [
        {
          "type": "uniform",
          "loc": 25200,
          "scale": 3600
        }
      ],
      "constraints": [
        "time_stamp >= 0",
        "time_stamp >= min_early_departure",
        "time_stamp <= max_early_departure"
      ],
      "dynamism": 0
    },
    {
      "name": "pickup_from",
      "type": "integer",
      "time_unit": "s",
      "expression": "time_stamp"
    },
    {
      "name": "pickup_to",
      "type": "integer",
      "time_unit": "s",
      "expression": "pickup_from + 120"
    },
    {
      "name": "dropoff_from",
      "type": "integer",
      "time_unit": "s",
      "expression": "pickup_to + drivingDuration"
    },
    {
      "name": "dropoff_to",
      "type": "integer",
      "time_unit": "s",
      "expression": "dropoff_from + 600"
    },
    {
      "name": "origin",
      "type": "location"
    },
    {
      "name": "destination",
      "type": "location"
    },
    {
      "name": "drivingDuration",
      "type": "integer",
      "time_unit": "s",
      "expression": "dtt(origin,destination)"
    },
    {
      "name": "drivingDistance",
      "type": "integer",
      "length_unit": "m",
      "expression": "dist_drive(origin,destination)"
    }
  ]
}