{
	"seed": 1,
	"network": "Chicago, Illinois",
	"problem": "ODBRP",
	"set_fixed_speed":
    {
        "vehicle_speed_data":20,
        "vehicle_speed_data_unit":"kmh"
    },
	"replicas": 1,
	"requests": 5000,
	"instance_filename": ["network", "problem", "requests"],
	"places":[
		{
			"name": "stadium",
			"type": "location",
			"lon": -87.655800,
			"lat": 41.948463
		}
	],
	"parameters":[
		{
			"name": "min_early_departure",
			"type": "float",
			"value": 17.0,
			"time_unit": "h"
		},
		{
			"name": "max_early_departure",
			"type": "float",
			"value": 19.0,
			"time_unit": "h"
		},
		{
			"name": "paramlat_arrival",
			"type": "integer",
			"value": 73800,
			"time_unit": "s"
		},
		{
			"name": "graphml",
			"type": "graphml",
			"value": true
		},
		{
			"name": "concertvenue",
			"type": "array_locations",
			"locs": "random",
			"size": 1,
			"value": ["stadium"]
		}
	],
	"attributes": [
		{  
			"name": "time_stamp",
			"type": "integer",
			"time_unit": "s",
			"pdf": [ {	"type": "normal",
						"loc": 64800,
						"scale": 3600
					} ],
			"constraints": [ "time_stamp >= 0", 
							"time_stamp >= min_early_departure",
							 "time_stamp <= max_early_departure"
						   ]
		},
		{
			"name": "reaction_time",
			"type": "integer",
			"time_unit": "s",
			"pdf": [ {	"type": "uniform",
						"loc": 300,
						"scale": 0
					} ]
		},
		{
			"name": "earliest_departure",
			"type": "integer",
			"time_unit": "s",
			"expression": "time_stamp",
			"constraints": [ "earliest_departure >= 0", 
							"earliest_departure >= min_early_departure"
						   ]
		},
		{
			"name": "latest_departure",
			"type": "integer",
			"time_unit": "s",
			"expression": "time_stamp + reaction_time"
		},
		{
			"name": "latest_arrival",
			"type": "integer",
			"time_unit": "s",
			"expression": "paramlat_arrival + 10"
		},
		{  
			"name": "origin",
			"type": "location",
			"subset_locations": "concertvenue"
		},
		{  
			"name": "destination",
			"type": "location"
		},
		{ 
			"name": "stops_orgn",
			"type": "array_primitives",
			"expression": "stops(origin)",
			"constraints": ["len(stops_orgn) > 0"]
		},
		{ 
			"name": "stops_dest",
			"type": "array_primitives",
			"expression": "stops(destination)",
			"constraints": ["len(stops_dest) > 0", "not (set(stops_orgn) & set(stops_dest))"]
		},
		{
			"name": "max_walking",
			"type": "integer",
			"time_unit": "s",
			"pdf": [ {	"type": "uniform",
						"loc": 550,
						"scale": 50
					} ],
			"output_csv": false
		},
		{
			"name": "walk_speed",
			"type": "real",
			"speed_unit": "mps",
			"pdf": [ {	"type": "uniform",
						"loc": 1.38889,
						"scale": 0
					} ],
			"output_csv": false
		},
		{
			"name": "direct_travel_time",
			"type": "integer",
			"time_unit": "s",
			"expression": "dtt(origin,destination)"
		},
		{
			"name": "direct_distance",
			"type": "integer",
			"length_unit": "m",
			"expression": "dist_drive(origin,destination)"
		}
	],
	"travel_time_matrix": ["bus_stations"]
}